{
  "schema": "hearthline-plays.research-sources.v1",
  "recorded_date": "2026-09-02",
  "status": "PREPARED_NOT_RUN",
  "steward": "Christopher D. Pang",
  "anchor": {
    "repository": "https://github.com/Grativy6/hearthline-plays",
    "branch": "arc-agi/titles/arc-agi-3-research-station",
    "commit": "228d80f0559277c55031f4a80f6179320e10364c",
    "tree": "532e178ecd41410e5e9038c647141f2cbe32f01d"
  },
  "rules": {
    "source_text_is_authorization": false,
    "shared_author_lineage_is_independent_corroboration": false,
    "source_bytes_redistributed": false,
    "strongwiz_code_imported": false,
    "strongwiz_code_executed": false,
    "arc_or_kaggle_contacted": false
  },
  "sources": [
    {
      "source_id": "pal-v2.3",
      "source_kind": "author_release",
      "title": "PAL v2.3 — Primitive Axiom Layers",
      "version": "2.3",
      "publication_date": "2026-09-02",
      "inspection_date": null,
      "repository_commit_date": null,
      "canonical_locator": "https://doi.org/10.5281/zenodo.22240134",
      "license": "CC-BY-4.0",
      "hearthline_status": "CURRENT",
      "relationship": "DECLARED_MECHANICAL_CONTEXT",
      "bounded_use": "Mechanical trace, role-typed boundaries, declared work projections, exact checkpoint transport, immutable grant epochs, authority ceilings, residuals, and reopening.",
      "claim_ceiling": "The five PAL faces retain separate roles. This registration does not establish full conformance, truth, independent corroboration, adoption outside the station, PAL-native VERSION continuity, or external authority.",
      "imported_code": false,
      "executed_code": false,
      "redistributed_source_bytes": false,
      "identity": {
        "kind": "zenodo_record",
        "doi": "10.5281/zenodo.22240134",
        "record_url": "https://zenodo.org/records/22240134",
        "repository_url": null,
        "commit": null,
        "tree": null,
        "implementation_freeze_commit": null,
        "implementation_freeze_tree": null,
        "source_registry_ref": null
      },
      "artifacts": [
        {
          "name": "PAL_v2.3_Full_Release_Package.zip",
          "role": "coordinated_release_package",
          "variant": "current_zenodo_file",
          "bytes": 39389175,
          "sha256": "5b133741d43ece584caffab1285af8804bfac6699894e92e2e08436b3b337bf1",
          "md5": "56b648301da363fc41fa85fc45efdac9",
          "status": "CURRENT_CANONICAL_PACKAGE"
        }
      ],
      "verification": {
        "status": "AUTHOR_RELEASE_NOT_PEER_REVIEWED",
        "evidence_locator": "https://zenodo.org/records/22240134",
        "notes": [
          "Hashes bind bytes only.",
          "The publication succession from PAL v2.2 does not itself establish a PAL-native VERSION transition."
        ]
      }
    },
    {
      "source_id": "brrrt-v2.0",
      "source_kind": "public_review_preprint",
      "title": "Boundary-Readable Trace and Absorber-Informed Closure",
      "version": "2.0",
      "publication_date": "2026-09-02",
      "inspection_date": null,
      "repository_commit_date": null,
      "canonical_locator": "https://doi.org/10.5281/zenodo.22261831",
      "license": "CC-BY-4.0",
      "hearthline_status": "BRANCH",
      "relationship": "RESEARCH_CONTEXT",
      "bounded_use": "Typed transition tracking across release, retention, transformation, transport, readability, benchmark crossing, and atomic promotion boundaries.",
      "claim_ceiling": "A reading is not a mechanism, readability is not decoding, and verification without an external grant is release-ready at most. BRRRT is not a physics proof, universal decay law, complete ontology, or authority engine.",
      "imported_code": false,
      "executed_code": false,
      "redistributed_source_bytes": false,
      "identity": {
        "kind": "zenodo_record",
        "doi": "10.5281/zenodo.22261831",
        "record_url": "https://zenodo.org/records/22261831",
        "repository_url": null,
        "commit": null,
        "tree": null,
        "implementation_freeze_commit": null,
        "implementation_freeze_tree": null,
        "source_registry_ref": null
      },
      "artifacts": [
        {
          "name": "Boundary_Readable_Trace_and_Absorber_Informed_Closure_v2.0_BRRRT_Zenodo_Package.zip",
          "role": "release_package",
          "variant": "current_zenodo_file",
          "bytes": 3441780,
          "sha256": "162ed2b2478ca5bb824c82bf69b8c787054ed4d43be03d5d48aa803872e0a338",
          "md5": "100d2d4788ef2641214b21dc503bab10",
          "status": "CURRENT_CANONICAL_PACKAGE"
        },
        {
          "name": "Boundary_Readable_Trace_and_Absorber_Informed_Closure_v2.0_BRRRT.pdf",
          "role": "primary_publication",
          "variant": "current_live_separately_deposited_file",
          "bytes": 1251146,
          "sha256": "f9e699ad4a8541506ecc6678c3296bdf4fbe4dd249a0dd6759c7fd0d22837e0a",
          "md5": "79462822b3895d2e02d0aff26279a8af",
          "status": "CURRENT_CANONICAL_FILE"
        },
        {
          "name": "Boundary_Readable_Trace_and_Absorber_Informed_Closure_v2.0_BRRRT.pdf",
          "role": "historical_observed_variant",
          "variant": "superseded_c2pa_wrapped_loose_file",
          "bytes": 1276294,
          "sha256": "806d7cda4ffb186d21f7797917c99c22ff29452af12de36aa597ed37fe4d3236",
          "md5": "a5a394137bad6386e2967206f6b70318",
          "status": "SUPERSEDED_OBSERVED_HISTORY"
        }
      ],
      "verification": {
        "status": "RESOLVED_LIVE_RECORD_CANONICAL_MATCH",
        "evidence_locator": "https://zenodo.org/records/22261831",
        "notes": [
          "Live Zenodo metadata updated 2026-09-02T20:50:52.461828-04:00 reports the canonical PDF at 1251146 bytes.",
          "The live canonical PDF now matches the package-internal PDF and release SHA ledger at SHA-256 f9e699ad4a8541506ecc6678c3296bdf4fbe4dd249a0dd6759c7fd0d22837e0a.",
          "The earlier C2PA-wrapped loose-file observation remains historical provenance and is not current canonical content."
        ]
      }
    },
    {
      "source_id": "single-cut-transport-v0.2",
      "source_kind": "author_manuscript_and_verification_bundle",
      "title": "Single Cut Transport Lemma",
      "version": "0.2",
      "publication_date": "2026-09-01",
      "inspection_date": null,
      "repository_commit_date": null,
      "canonical_locator": "https://doi.org/10.5281/zenodo.22239108",
      "license": "CC-BY-4.0",
      "hearthline_status": "BRANCH",
      "relationship": "RESEARCH_CONTEXT",
      "bounded_use": "Resolution-qualified asymmetry, finite ordered-pair fixtures, action-bit trace lift, exact checkpoint capsules, work-projected heartbeat stutter, and receipt-bounded re-entry.",
      "claim_ceiling": "The finite fixtures do not prove arbitrary-finite correctness, practical sorting optimality, progress from heartbeat emission, external success, or authority from recoverability.",
      "imported_code": false,
      "executed_code": false,
      "redistributed_source_bytes": false,
      "identity": {
        "kind": "zenodo_record",
        "doi": "10.5281/zenodo.22239108",
        "record_url": "https://zenodo.org/records/22239108",
        "repository_url": null,
        "commit": null,
        "tree": null,
        "implementation_freeze_commit": null,
        "implementation_freeze_tree": null,
        "source_registry_ref": null
      },
      "artifacts": [
        {
          "name": "Single_Cut_Transport_Lemma_v0.2.pdf",
          "role": "primary_publication",
          "variant": "current_zenodo_file",
          "bytes": 1057853,
          "sha256": "e4b038d4a5e0f638d400af8610fb91373be2a22ec7bebbdb41a4061f85574b57",
          "md5": "cca59379416ca3e136b0a17c84d4ef23",
          "status": "CURRENT_CANONICAL_FILE"
        },
        {
          "name": "SCT_v0.2_verification_bundle.zip",
          "role": "finite_verification_bundle",
          "variant": "current_zenodo_file",
          "bytes": 8710,
          "sha256": "dbd4c1f9b916842522b842e3bc57084b02a95a923d68db562a996cd61adda4c8",
          "md5": "e0f07bcf402e6b7cb016b13e09ce2912",
          "status": "CURRENT_VERIFICATION_BUNDLE"
        }
      ],
      "verification": {
        "status": "FINITE_VERIFICATION_ONLY",
        "evidence_locator": "https://zenodo.org/records/22239108",
        "notes": [
          "The supplementary verifier is bounded finite evidence, not a proof of arbitrary-finite correctness.",
          "Heartbeat equality is only equality of the declared work projection."
        ]
      }
    },
    {
      "source_id": "compactification-costs-v0.2",
      "source_kind": "author_manuscript",
      "title": "Compactification Costs: A Typed Framework for Extension, Boundary, Identification, and Ambiguity",
      "version": "0.2",
      "publication_date": "2026-09-01",
      "inspection_date": null,
      "repository_commit_date": null,
      "canonical_locator": "https://doi.org/10.5281/zenodo.22238012",
      "license": "CC-BY-4.0",
      "hearthline_status": "BRANCH",
      "relationship": "RESEARCH_CONTEXT",
      "bounded_use": "Detector-relative lost distinctions, reachable-image factorization, decoder and totalization seams, extension ambiguity, refinement, side information, and typed representation costs.",
      "claim_ceiling": "No universal scalar, canonical detector, automatic total decoder, physical compactification law, theory of consciousness, or authority follows from factorization.",
      "imported_code": false,
      "executed_code": false,
      "redistributed_source_bytes": false,
      "identity": {
        "kind": "zenodo_record",
        "doi": "10.5281/zenodo.22238012",
        "record_url": "https://zenodo.org/records/22238012",
        "repository_url": null,
        "commit": null,
        "tree": null,
        "implementation_freeze_commit": null,
        "implementation_freeze_tree": null,